[I 2025-04-06 17:08:58,607] A new study created in memory with name: no-name-0a578913-3b79-4729-9dc4-d61678f55b26
[I 2025-04-06 17:24:59,615] Trial 0 finished with value: 0.8638938548338271 and parameters: {'iterations': 4000, 'depth': 10, 'learning_rate': 0.7322619478695936, 'l2_leaf_reg': 0.9846738873614566, 'bootstrap_type': 'Bayesian', 'grow_policy': 'Depthwise', 'min_data_in_leaf': 71, 'bagging_temperature': 0.20584494295802447}. Best is trial 0 with value: 0.8638938548338271.
[I 2025-04-06 18:15:28,720] Trial 1 finished with value: 0.9265044139883825 and parameters: {'iterations': 10000, 'depth': 9, 'learning_rate': 0.21312677156759788, 'l2_leaf_reg': 0.008111941985431923, 'bootstrap_type': 'Bernoulli', 'grow_policy': 'SymmetricTree', 'min_data_in_leaf': 62, 'subsample': 0.22554447458683766}. Best is trial 1 with value: 0.9265044139883825.
[I 2025-04-06 18:25:15,561] Trial 2 finished with value: 0.8645880104295773 and parameters: {'iterations': 3000, 'depth': 6, 'learning_rate': 0.4566139142328189, 'l2_leaf_reg': 8.43101393208247, 'bootstrap_type': 'Bernoulli', 'grow_policy': 'Lossguide', 'min_data_in_leaf': 18, 'subsample': 0.1585464336867516}. Best is trial 1 with value: 0.9265044139883825.
[I 2025-04-06 18:56:13,734] Trial 3 finished with value: 0.8531397617169623 and parameters: {'iterations': 10000, 'depth': 10, 'learning_rate': 0.8085889507683447, 'l2_leaf_reg': 0.03334792728637585, 'bootstrap_type': 'Bernoulli', 'grow_policy': 'Lossguide', 'min_data_in_leaf': 4, 'subsample': 0.9183883618709039}. Best is trial 1 with value: 0.9265044139883825.
[I 2025-04-06 19:09:43,234] Trial 4 finished with value: 0.83951392962813 and parameters: {'iterations': 3000, 'depth': 8, 'learning_rate': 0.31239936501332155, 'l2_leaf_reg': 0.39841905944346884, 'bootstrap_type': 'Bayesian', 'grow_policy': 'SymmetricTree', 'min_data_in_leaf': 90, 'bagging_temperature': 5.978999788110851}. Best is trial 1 with value: 0.9265044139883825.
[I 2025-04-06 19:26:09,639] Trial 5 finished with value: 0.4100994989692975 and parameters: {'iterations': 10000, 'depth': 4, 'learning_rate': 0.19678687955672605, 'l2_leaf_reg': 0.0016832027985721903, 'bootstrap_type': 'Bernoulli', 'grow_policy': 'Depthwise', 'min_data_in_leaf': 29, 'subsample': 0.5884264748424236}. Best is trial 1 with value: 0.9265044139883825.
[I 2025-04-06 19:34:08,811] Trial 6 finished with value: 0.7016089417448745 and parameters: {'iterations': 2000, 'depth': 9, 'learning_rate': 0.07547609303609105, 'l2_leaf_reg': 85.98737339212276, 'bootstrap_type': 'Bayesian', 'grow_policy': 'Depthwise', 'min_data_in_leaf': 73, 'bagging_temperature': 7.712703466859457}. Best is trial 1 with value: 0.9265044139883825.
[I 2025-04-06 19:38:16,131] Trial 7 finished with value: 0.599021938499406 and parameters: {'iterations': 1000, 'depth': 6, 'learning_rate': 0.11675319046560459, 'l2_leaf_reg': 20.67840939783948, 'bootstrap_type': 'Bayesian', 'grow_policy': 'Lossguide', 'min_data_in_leaf': 73, 'bagging_temperature': 6.3755747135521315}. Best is trial 1 with value: 0.9265044139883825.
[I 2025-04-06 20:08:28,542] Trial 8 finished with value: 0.9281485757704309 and parameters: {'iterations': 9000, 'depth': 7, 'learning_rate': 0.1204746516923634, 'l2_leaf_reg': 3.6831884165358977, 'bootstrap_type': 'Bayesian', 'grow_policy': 'SymmetricTree', 'min_data_in_leaf': 43, 'bagging_temperature': 0.2541912674409519}. Best is trial 8 with value: 0.9281485757704309.
[I 2025-04-06 20:13:16,046] Trial 9 finished with value: 0.810183940063618 and parameters: {'iterations': 2000, 'depth': 4, 'learning_rate': 0.6367740008525166, 'l2_leaf_reg': 0.03730610475453591, 'bootstrap_type': 'Bernoulli', 'grow_policy': 'Lossguide', 'min_data_in_leaf': 23, 'subsample': 0.1692819188459137}. Best is trial 8 with value: 0.9281485757704309.
[I 2025-04-06 20:35:51,248] Trial 10 finished with value: 0.8849178671463382 and parameters: {'iterations': 7000, 'depth': 7, 'learning_rate': 0.9695675736770781, 'l2_leaf_reg': 2.2716651949429774, 'bootstrap_type': 'Bayesian', 'grow_policy': 'SymmetricTree', 'min_data_in_leaf': 43, 'bagging_temperature': 0.10877427136208762}. Best is trial 8 with value: 0.9281485757704309.
[I 2025-04-06 21:01:54,739] Trial 11 finished with value: 0.5104981242830574 and parameters: {'iterations': 8000, 'depth': 8, 'learning_rate': 0.3169514678930264, 'l2_leaf_reg': 0.0011172431178062237, 'bootstrap_type': 'Bernoulli', 'grow_policy': 'SymmetricTree', 'min_data_in_leaf': 51, 'subsample': 0.4468995359946669}. Best is trial 8 with value: 0.9281485757704309.
[I 2025-04-06 21:27:42,510] Trial 12 finished with value: 0.7368188496123865 and parameters: {'iterations': 8000, 'depth': 7, 'learning_rate': 0.010318738156147172, 'l2_leaf_reg': 0.026414936021848863, 'bootstrap_type': 'Bernoulli', 'grow_policy': 'SymmetricTree', 'min_data_in_leaf': 51, 'subsample': 0.43974485684696596}. Best is trial 8 with value: 0.9281485757704309.
[I 2025-04-06 21:50:20,447] Trial 13 finished with value: 0.5719797877971697 and parameters: {'iterations': 6000, 'depth': 8, 'learning_rate': 0.25444046036011114, 'l2_leaf_reg': 0.005592041924892119, 'bootstrap_type': 'Bayesian', 'grow_policy': 'SymmetricTree', 'min_data_in_leaf': 61, 'bagging_temperature': 3.1788188230012366}. Best is trial 8 with value: 0.9281485757704309.
[I 2025-04-06 22:13:31,415] Trial 14 finished with value: 0.8419287985590967 and parameters: {'iterations': 9000, 'depth': 6, 'learning_rate': 0.49413591742093854, 'l2_leaf_reg': 0.1340563596275462, 'bootstrap_type': 'Bayesian', 'grow_policy': 'SymmetricTree', 'min_data_in_leaf': 92, 'bagging_temperature': 9.960169893612136}. Best is trial 8 with value: 0.9281485757704309.
[I 2025-04-06 22:51:12,198] Trial 15 finished with value: 0.9403047473414174 and parameters: {'iterations': 9000, 'depth': 9, 'learning_rate': 0.4157914097469369, 'l2_leaf_reg': 2.903024289230021, 'bootstrap_type': 'Bernoulli', 'grow_policy': 'SymmetricTree', 'min_data_in_leaf': 44, 'subsample': 0.10309305956372039}. Best is trial 15 with value: 0.9403047473414174.
[I 2025-04-06 23:05:48,394] Trial 16 finished with value: 0.9040684803744273 and parameters: {'iterations': 6000, 'depth': 5, 'learning_rate': 0.41713241000762435, 'l2_leaf_reg': 3.489205912186873, 'bootstrap_type': 'Bernoulli', 'grow_policy': 'SymmetricTree', 'min_data_in_leaf': 37, 'subsample': 0.7460580537149243}. Best is trial 15 with value: 0.9403047473414174.
[I 2025-04-06 23:44:48,894] Trial 17 finished with value: 0.9022080934212946 and parameters: {'iterations': 8000, 'depth': 9, 'learning_rate': 0.6066847725963113, 'l2_leaf_reg': 27.470866234797974, 'bootstrap_type': 'Bayesian', 'grow_policy': 'SymmetricTree', 'min_data_in_leaf': 12, 'bagging_temperature': 2.9455894751326994}. Best is trial 15 with value: 0.9403047473414174.
[I 2025-04-07 00:01:44,477] Trial 18 finished with value: 0.9210024005325879 and parameters: {'iterations': 5000, 'depth': 7, 'learning_rate': 0.39623208894235024, 'l2_leaf_reg': 0.34471391964615905, 'bootstrap_type': 'Bernoulli', 'grow_policy': 'SymmetricTree', 'min_data_in_leaf': 34, 'subsample': 0.3500245999796786}. Best is trial 15 with value: 0.9403047473414174.
[I 2025-04-07 00:30:40,449] Trial 19 finished with value: 0.8802653078678555 and parameters: {'iterations': 9000, 'depth': 8, 'learning_rate': 0.5766275102179319, 'l2_leaf_reg': 1.8970819320146155, 'bootstrap_type': 'Bayesian', 'grow_policy': 'Depthwise', 'min_data_in_leaf': 42, 'bagging_temperature': 2.3611710967595023}. Best is trial 15 with value: 0.9403047473414174.
[I 2025-04-07 00:47:26,798] Trial 20 finished with value: 0.8846837774178484 and parameters: {'iterations': 7000, 'depth': 5, 'learning_rate': 0.13595519225985767, 'l2_leaf_reg': 7.08634399555509, 'bootstrap_type': 'Bernoulli', 'grow_policy': 'SymmetricTree', 'min_data_in_leaf': 57, 'subsample': 0.6693673534860866}. Best is trial 15 with value: 0.9403047473414174.
[I 2025-04-07 01:39:48,257] Trial 21 finished with value: 0.9436553431333771 and parameters: {'iterations': 10000, 'depth': 9, 'learning_rate': 0.2191958803453538, 'l2_leaf_reg': 0.12215757018876296, 'bootstrap_type': 'Bernoulli', 'grow_policy': 'SymmetricTree', 'min_data_in_leaf': 62, 'subsample': 0.2716174004724779}. Best is trial 21 with value: 0.9436553431333771.
[I 2025-04-07 02:17:00,641] Trial 22 finished with value: 0.9376513018687389 and parameters: {'iterations': 9000, 'depth': 9, 'learning_rate': 0.3334039084097846, 'l2_leaf_reg': 0.12316900388660054, 'bootstrap_type': 'Bernoulli', 'grow_policy': 'SymmetricTree', 'min_data_in_leaf': 81, 'subsample': 0.10057820257994737}. Best is trial 21 with value: 0.9436553431333771.
[I 2025-04-07 03:14:26,623] Trial 23 finished with value: 0.9392066202296132 and parameters: {'iterations': 9000, 'depth': 10, 'learning_rate': 0.32512323384111264, 'l2_leaf_reg': 0.09430072612906934, 'bootstrap_type': 'Bernoulli', 'grow_policy': 'SymmetricTree', 'min_data_in_leaf': 84, 'subsample': 0.13884050017428762}. Best is trial 21 with value: 0.9436553431333771.
[I 2025-04-07 04:26:20,986] Trial 24 finished with value: 0.9515609636253671 and parameters: {'iterations': 10000, 'depth': 10, 'learning_rate': 0.38709375148908315, 'l2_leaf_reg': 0.6515527694891259, 'bootstrap_type': 'Bernoulli', 'grow_policy': 'SymmetricTree', 'min_data_in_leaf': 99, 'subsample': 0.30127034898839467}. Best is trial 24 with value: 0.9515609636253671.
[I 2025-04-07 05:36:50,529] Trial 25 finished with value: 0.9422360820669248 and parameters: {'iterations': 10000, 'depth': 10, 'learning_rate': 0.5590361632154756, 'l2_leaf_reg': 0.6788774615475839, 'bootstrap_type': 'Bernoulli', 'grow_policy': 'SymmetricTree', 'min_data_in_leaf': 96, 'subsample': 0.3114592813914708}. Best is trial 24 with value: 0.9515609636253671.
[I 2025-04-07 06:47:14,009] Trial 26 finished with value: 0.9455827688709965 and parameters: {'iterations': 10000, 'depth': 10, 'learning_rate': 0.5665319354761628, 'l2_leaf_reg': 0.8122891150156081, 'bootstrap_type': 'Bernoulli', 'grow_policy': 'SymmetricTree', 'min_data_in_leaf': 99, 'subsample': 0.2753249268455333}. Best is trial 24 with value: 0.9515609636253671.
[I 2025-04-07 07:37:28,803] Trial 27 finished with value: 0.9416699716216383 and parameters: {'iterations': 7000, 'depth': 10, 'learning_rate': 0.6795319442721794, 'l2_leaf_reg': 0.929556585782931, 'bootstrap_type': 'Bernoulli', 'grow_policy': 'SymmetricTree', 'min_data_in_leaf': 98, 'subsample': 0.30964103250612535}. Best is trial 24 with value: 0.9515609636253671.
[I 2025-04-07 08:03:45,510] Trial 28 finished with value: 0.8723922516789242 and parameters: {'iterations': 10000, 'depth': 10, 'learning_rate': 0.8286054719146096, 'l2_leaf_reg': 0.15238567289153876, 'bootstrap_type': 'Bernoulli', 'grow_policy': 'Lossguide', 'min_data_in_leaf': 84, 'subsample': 0.4316805899209319}. Best is trial 24 with value: 0.9515609636253671.
[I 2025-04-07 08:30:40,985] Trial 29 finished with value: 0.9001058793404433 and parameters: {'iterations': 8000, 'depth': 10, 'learning_rate': 0.5086007781312727, 'l2_leaf_reg': 0.6194102551640681, 'bootstrap_type': 'Bernoulli', 'grow_policy': 'Depthwise', 'min_data_in_leaf': 69, 'subsample': 0.256071415148395}. Best is trial 24 with value: 0.9515609636253671.
Best CatBoost Parameters: {'iterations': 10000, 'depth': 10, 'learning_rate': 0.38709375148908315, 'l2_leaf_reg': 0.6515527694891259, 'bootstrap_type': 'Bernoulli', 'grow_policy': 'SymmetricTree', 'min_data_in_leaf': 99, 'subsample': 0.30127034898839467}